registry_id,role,title,classification,variables,canonical_statement,canonical_equation,encyclopedia_digest,master_row_digest,source_paths
ID0335,Modified_Einstein_Source_Equation,Gravitational Emergence Modification to Einstein Equations,,,"TZP singularities introduce additional source terms into the Einstein equations, altering spacetime curvature.",R_{/mu/nu}-/frac{1}{2}g_{/mu/nu}R+/Lambda g_{/mu/nu}=/frac{8/pi G}{c^4}T_{/mu/nu}+/Phi_{/mu/nu}^{/mathrm{TZP}} || /Phi_{/mu/nu}^{/mathrm{TZP}} /to 0 /qquad /text{far from the TZP},404174fe588354c866eb6b61ba856660679bc9b0,340cbe17ec24dbb67546eef0175fca31db042bb7,D:\Zenodo\Gravitational-Emergence-TPZ-.pdf | D:\Zenodo\Universal_Field_Theory_Rendered.pdf | D:\Zenodo\trawin_zero_point_quantum_field_theory.pdf | D:\Tex\TEX_20260224_182530\Volume_02_Complete.tex | D:\Tex\TEX_20260224_182530\Universal_Field_via_Bridge_Tunnel_Theory_SECOND_PASS.tex | D:\Tex\TEX_20260224_182530\Vol.01.tex
ID0400,Cosmological_Constant_Master_Equation,Cosmological Constant and Master Unification Equation,,,"ID 400 establishes the cosmological constant and master unification equation as the handoff from TZP vacuum pressure residue into the registry's metric and stress energy chain. In this entry, Lambda is treated as an emergent residual vacuum pressure after topological equilibration at the Trawin Zero Point; the equation chain regularizes vacuum density against global topological and information constraints, leaving a small positive state pressure. It prepares ID 401, where the electromagnetic stress energy tensor converts that residue into momentum flux.","/begin{adjustbox}{max width=/linewidth,center} $/displaystyle /rho_{/Lambda}=/frac{/hbar c}{R^4}/,/frac{/Phi_0}{/Phi_{/mathrm{total}}}/sim H_0^2/approx6/times10^{-10}/,/mathrm{J/,m^{-3}} $ /end{adjustbox}",c8d71173e247ceb56916407f3340b7726346f69e,0e9c0082e5aa9f37f165216efa24bc2327f9eb8f,D:\Zenodo\Gravitational-Emergence-TPZ-.pdf | D:\Zenodo\Universal_Field_Theory_Rendered.pdf | D:\Zenodo\trawin_zero_point_quantum_field_theory.pdf | D:\Tex\TEX_20260224_182530\Volume_02_Complete.tex | D:\Tex\TEX_20260224_182530\Universal_Field_via_Bridge_Tunnel_Theory_SECOND_PASS.tex | D:\Tex\TEX_20260224_182530\Vol.01.tex
ID1392,Cosmological_Constant_Normalized_Duplicate,Cosmological Constant and Master Unification Equation,,,"ID 400 establishes the cosmological constant and master unification equation as the handoff from TZP vacuum pressure residue into the registry's metric and stress energy chain. In this entry, Lambda is treated as an emergent residual vacuum pressure after topological equilibration at the Trawin Zero","/rho_{/Lambda}=/frac{/hbar c}{R^4}/,/frac{/Phi_0}{/Phi_{/mathrm{total}}}/sim H_0^2/approx6/times10^{-10}/,/mathrm{J/,m^{-3}}",8840feb927670e054bb9afe9a9428e3fcf672e91,21f64597342d859ba623e4cfdda61453042ec713,D:\Zenodo\Gravitational-Emergence-TPZ-.pdf | D:\Zenodo\Universal_Field_Theory_Rendered.pdf | D:\Zenodo\trawin_zero_point_quantum_field_theory.pdf | D:\Tex\TEX_20260224_182530\Volume_02_Complete.tex | D:\Tex\TEX_20260224_182530\Universal_Field_via_Bridge_Tunnel_Theory_SECOND_PASS.tex | D:\Tex\TEX_20260224_182530\Vol.01.tex
ID0167,Unified_Einstein_Total_Stress_Energy,Unified Field Equation (EinsteinYangMillsQuantum),,,This generalizes Einstein's field equations by including gauge field strengths and quantum vacuum contributions; it states that geometry responds to the sum of all forms of energy and vacuum fluctuations.,"G_{/mu/nu}+/Lambda g_{/mu/nu} = /frac{8/pi G}{c^4}/,T_{/mu/nu}^{/mathrm{tot}} || T_{/mu/nu}^{/mathrm{tot}} = T_{/mu/nu}^{/mathrm{grav}}+ T_{/mu/nu}^{/mathrm{EM}}+ T_{/mu/nu}^{/mathrm{weak}}+ T_{/mu/nu}^{/mathrm{strong}}+ T_{/mu/nu}^{/mathrm{vac}} || /nabla^{/nu}T_{/mu/nu}^{/mathrm{tot}}=0",817c9bed4668fd0e368de0c148e989ed47eb67d6,298d0620053fce6fdb8aff6677f15d78c074d37a,D:\Zenodo\Gravitational-Emergence-TPZ-.pdf | D:\Zenodo\Universal_Field_Theory_Rendered.pdf | D:\Zenodo\trawin_zero_point_quantum_field_theory.pdf | D:\Tex\TEX_20260224_182530\Volume_02_Complete.tex | D:\Tex\TEX_20260224_182530\Universal_Field_via_Bridge_Tunnel_Theory_SECOND_PASS.tex | D:\Tex\TEX_20260224_182530\Vol.01.tex
ID0394,TZP_Vacuum_Stress_Energy_Tensor,TZP BridgeTunnel EnergyMomentum Tensor,,,"At a Trawin Zero Point, the energy--momentum tensor takes a diagonal form T??TZP=diag(?vacuum,ptopological,ptopological,ptopological),TmunuTZP=diag(rhovacuum,ptopological,ptopological,ptopological), where the vacuum energy density ?vacuumrhovacuum diverges following a Bessel-function behaviour, and the pressures ptopologicalptopological arise from topological terms. Coupling this tensor into Einstein's equations drives gravitational field generation and constitutes the ``bridge--tunnel' mechanism.",T^{/mathrm{TZP}}_{/mu/nu}=/rho_{/mathrm{vac}}u_{/mu}u_{/nu}+p_{/mathrm{vac}}g_{/mu/nu} || /rho_{/mathrm{vac}}(r)/sim J_{0}(kr)^{-1},f3e5c8e80f8cf8a239d321773024922cbf4b9e28,299d95945562d9245770a665dfceffbc39a988db,D:\Zenodo\Gravitational-Emergence-TPZ-.pdf | D:\Zenodo\Universal_Field_Theory_Rendered.pdf | D:\Zenodo\trawin_zero_point_quantum_field_theory.pdf | D:\Tex\TEX_20260224_182530\Volume_02_Complete.tex | D:\Tex\TEX_20260224_182530\Universal_Field_via_Bridge_Tunnel_Theory_SECOND_PASS.tex | D:\Tex\TEX_20260224_182530\Vol.01.tex
ID0958,Unified_Operator_Action_Effective_Einstein,Unified Operator Action,,,"The TZPOPERA entry records the unified operator action that couples a wave operator, effective Einstein sector, and total Lagrangian carrier into one admissible TRAWIN transport statement.","/left(/nabla^{2}-/frac{1}{c^{2}}/partial_{t}^{2}/right)A=N_{/rho} || R_{/mu/nu}-/frac{1}{2}Rg_{/mu/nu}+/Lambda_{/mathrm{eff}}(r)g_{/mu/nu} =/frac{8/pi G}{c^{4}}/langle T_{/mu/nu}/rangle_{/mathrm{TZP}} || /mathcal{L}_{U}=/frac{c^{4}}{16/pi G}R[g]+/mathcal{L}_{/mathrm{QFT}}[/Psi,A_{/mu}] +/mathcal{L}_{/mathrm{topo}}[A_{/mu}]+/mathcal{L}_{/mathrm{info}}[/Phi]",9d2bd0e3e84cbbf8b3ee386e1015c6e46ca5599a,10112ddbebaeae864f3dc01ffdcbccdf88304318,D:\Zenodo\Gravitational-Emergence-TPZ-.pdf | D:\Zenodo\Universal_Field_Theory_Rendered.pdf | D:\Zenodo\trawin_zero_point_quantum_field_theory.pdf | D:\Tex\TEX_20260224_182530\Volume_02_Complete.tex | D:\Tex\TEX_20260224_182530\Universal_Field_via_Bridge_Tunnel_Theory_SECOND_PASS.tex | D:\Tex\TEX_20260224_182530\Vol.01.tex
